Timestamp,"I understand that contributed datasets will be made available under a CC-BY or similar license. This means that the COSORE database will be open without restriction to the science community; we strongly encourage database users to cite original publications and offer co-authorship, but it's not required.",I have all necessary authority and permissions (legal or otherwise) to provide these data to the COSORE database.,"Once we've worked through the metadata below, we'll send you a custom data upload link.","COSORE is a community database, but not an institutionally-backed repository like Figshare, DataONE, ESS-DIVE, etc. We recommend depositing your data in one of these first, and providing its DOI below.",First (given) name,Last (family) name,Email,ORCID ID,CRediT role(s) (https://www.casrai.org/credit.html),"Other contributors (give name, ORCID, email, CRediT role)",Site name,Longitude (decimal degrees),Latitude (decimal degrees),Elevation (m),"UTC offset (from UTC, hours, standard time)",IGBP land cover code,"Network and Site ID if applicable (e.g. ""Ameriflux US-MMF"") ",Primary species present,Primary publication DOI or URL,Other publications DOIs or URLs,Data DOI or URL,Acknowledgment text,Measurement instrument,Plants removed from chambers?,Opaque chambers?,Chamber ground area (cm2),Chamber/port treatments [Port (chamber) 1],Chamber/port treatments [Port (chamber) 2],Chamber/port treatments [Port (chamber) 3],Chamber/port treatments [Port (chamber) 4],Chamber/port treatments [Port (chamber) 5],Chamber/port treatments [Port (chamber) 6],Chamber/port treatments [Port (chamber) 7],Chamber/port treatments [Port (chamber) 8],"If your port/treatment design is more complicated than what's above, we'll get in touch.",Chamber/ports all monitor the same species (from 'Site' section above)?,Ancillary data included,"I have ancillary site data to contribute (LAI, NPP, etc)",Other things we should know about this dataset?
5/17/2019 18:44:49,Yes,Yes,Okay,Got it,Marguerite,Mauritz,memauritz@utep.edu,0000-0001-8733-9119,"Investigation, Data curation, Data analysis","David Lipson; dlipson@sdsu.edu; funding aquisition, advising, investigation",SDSU Santa Margarita Ecological Reserve,117.1641667,33.44163333,393,-8,Open shrubland,,"Coastal Sage Scrub (CSS) vegetation is dominated by the native shrubs Artemisia californica, Eriogonum fasciculatum and Salvia mellifera; intershrub spaces contain invasive annual grasses Bromus madritensis var. rubens and forbs Centaurea solstitialis and Hirschfeldia incana",,10.5194/bgd-10-6335-2013,,This data was originally collected and analysed by Marguerite Mauritz and David Lipson to investigate soil respiration patterns in semi-arid shrubland invaded by annual grasses and forbs. The LI-8100 was kindly loaned by Walt Oechel. ,LI-8100A (processed data),Yes,Yes,314,Treatment,Treatment,Treatment,Treatment,Treatment,Treatment,Treatment,Treatment,"Yes, it's more complicated",Different species,"Soil temp, Soil moisture",,
5/20/2019 13:19:02,Yes,Yes,Okay,Got it,Nadine,Ruehr,nadine.ruehr@kit.edu,https://orcid.org/0000-0001-5989-7463,"Funding acquisition, Investigation, Data curation",Beverly Law,Young pine plantation; US-ME6,-121.6078,44.3232842,998,-8,Evergreen needleleaf forest,Ameriflux US-ME6,Pinus ponderosa,10.1016/j.agrformet.2012.05.015,10.5194/bg-11-4139-2014,NA,,LI-8100A (processed data),Yes,No,317.8,Treatment,Treatment,None,Treatment,None,Treatment,Treatment,None,"Yes, it's more complicated",Same species,"Air temp, Soil temp, Soil moisture, PAR, Other",Yes,Ports did not monitor the same plots/treatments continuously. 
5/22/2019 0:09:22,Yes,Yes,Okay,Got it,Debjani,Sihi,sihid@ornl.gov,0000-0002-5513-8862,"Funding acquisition, Investigation, Data curation","Eric A. Davidson (0000-0002-8525-8697, edavidson@umces.edu, PI), Kathleen E. Savage (savage@whrc.org, data curator). ","Howland Forest, Howland, Maine, USA",-68.7402,45.2041,60,-4,Evergreen needleleaf forest,US-Ho1,"The dominant tree species are red spruce (Picea rubens Sarg.) and eastern hemlock (Tsuga canadensis (L.) Carr.), with associated mixed hardwoods.",https://doi.org/10.1016/j.agrformet.2018.01.026,https://doi.org/10.1002/2016JG003386,Soil respiration data are made available along with the code used for the primary publication in this GitHub repository: https://github.com/trevorkeenan/FoBAAR-DAMM,Those who intend to use the continuous soil respiration dataset from the Howland forest site for their research are strongly encouraged to contact and acknowledge the contributors listed above.,LI-8100A (processed data),Yes,Yes,491,None,Treatment,None,Treatment,None,Treatment,None,None,"Yes, it's more complicated",Same species,"Air temp, Soil temp, Soil moisture, PAR",Yes,"Two things to consider: 
1. We have continuous data from 2004-2015 for six chambers. However, we have done the root trenching experiment during 2013–15 for three chambers.
2. David Hollinger (site PI) is the contact person for ancillary dataset (other than soil temperature and soil moisture). Should this be considered for the ""contributor(s)"" section?"
5/22/2019 3:44:34,Yes,Yes,Okay,Got it,Debjani,Sihi,sihid@ornl.gov,0000-0002-5513-8862,"Funding acquisition, Investigation, Data curation","Eric A. Davidson (0000-0002-8525-8697, edavidson@umces.edu, PI), Kathleen E. Savage (savage@whrc.org, data curator)",Harvard Forest,-72.1715,42.5378,340,-4,Deciduous broadleaf forest,Ameriflux US-Ha1,Stands in this forest consist primarily of red oak (Quercus rubra) and red maple (Acer rubrum).,https://doi.org/10.1016/j.agrformet.2018.01.026,"https://link.springer.com/article/10.1007/s10533-018-0472-8, https://onlinelibrary.wiley.com/doi/full/10.1111/gcb.12108, https://agupubs.onlinelibrary.wiley.com/doi/pdf/10.1002/2017JG003796, 10.1016/j.agrformet.2009.07.008, https://onlinelibrary.wiley.com/doi/full/10.1111/j.1365-2486.2011.02546.x",http://harvardforest.fas.harvard.edu:8080/exist/apps/datasets/showData.html?id=hf006,Those who intend to use the continuous soil respiration dataset from the Harvard forest site for their research are strongly encouraged to contact and acknowledge the contributors listed above.,Li-COR IRGA 6252 (processed data),Yes,Yes,491,None,None,None,None,None,None,None,None,"Yes, it's more complicated",Different species,"Soil temp, Soil moisture",,"We have automated data from the control (2012-2014) and root-trenched (2013-2014) chambers from US-Ha1 (EMS tower site). Additionally, we have automated chamber data from different stands withing Harvard forest for three more years (2003, 2009, and 2010) with different treatments (trenching, rainfall exclusion, root exudation etc) based on different research objectives in each study. 

We have soil temperature and soil moisture data for all chambers. Other ancillary data are generally available from the Harvard Forest LTER website."